{
  "$schema": "./acceptance-map.schema.json",
  "schemaVersion": 1,
  "updatedAt": "2026-10-30",
  "owner": "BGA-128",
  "cases": [
    {
      "item": "BGA-007",
      "case": "Facts and suggestions are distinct in a public result",
      "boundary": "packaged",
      "scenarios": ["E2E-VALIDATE-STATES-SEEDED-DEFECTS"]
    },
    {
      "item": "BGA-007",
      "case": "Heuristic findings expose their uncertainty to the client",
      "boundary": "packaged",
      "scenarios": ["E2E-VALIDATE-STATES-SEEDED-DEFECTS"]
    },
    {
      "item": "BGA-007",
      "case": "Results carry human-readable content beside stable machine fields",
      "boundary": "packaged",
      "scenarios": ["E2E-VALIDATE-STATES-CLEAN"]
    },
    {
      "item": "BGA-008",
      "case": "Fixtures contain no private source, publisher artwork, or credential",
      "boundary": "repository",
      "scenarios": ["GATE-FIXTURE-SAFETY"]
    },
    {
      "item": "BGA-008",
      "case": "Each fixture declares the normalized model and findings the product actually produces",
      "boundary": "repository",
      "scenarios": ["GATE-FIXTURE-SAFETY"]
    },
    {
      "item": "BGA-008",
      "case": "Each fixture identifies the BGA behavior it represents",
      "boundary": "repository",
      "scenarios": ["GATE-FIXTURE-SAFETY"]
    },
    {
      "item": "BGA-016",
      "case": "A refused path is reported with a stable code and no leaked location",
      "boundary": "packaged",
      "scenarios": ["E2E-INSPECT-PROJECT-UNLISTED-ROOT"]
    },
    {
      "item": "BGA-016",
      "case": "Secrets inside a project never reach a successful result",
      "boundary": "packaged",
      "scenarios": ["E2E-INSPECT-PROJECT-REDACTION"]
    },
    {
      "item": "BGA-016",
      "case": "An unexpected validator failure keeps a stable code and safe context",
      "boundary": "packaged",
      "scenarios": ["E2E-VALIDATE-PROJECT-PARTIAL-FAILURE"]
    },
    {
      "item": "BGA-016",
      "case": "Redaction is proven for every tool that returns project content",
      "boundary": "packaged",
      "scenarios": ["E2E-TOOLS-REDACTION"]
    },
    {
      "item": "BGA-100",
      "case": "Detection identifies the components a project actually has",
      "boundary": "packaged",
      "scenarios": [
        "E2E-INSPECT-PROJECT-LEGACY",
        "E2E-INSPECT-PROJECT-MODERN",
        "E2E-INSPECT-PROJECT-HYBRID"
      ]
    },
    {
      "item": "BGA-100",
      "case": "A project matching no layout is reported with the markers that were found",
      "boundary": "packaged",
      "scenarios": ["E2E-INSPECT-PROJECT-UNRECOGNIZED"]
    },
    {
      "item": "BGA-100",
      "case": "Detection never reads outside the configured root",
      "boundary": "packaged",
      "scenarios": ["E2E-INSPECT-PROJECT-TRAVERSAL", "E2E-INSPECT-PROJECT-SYMLINK-ESCAPE"]
    },
    {
      "item": "BGA-100",
      "case": "An empty project directory is reported rather than treated as unreadable",
      "boundary": "packaged",
      "scenarios": ["E2E-INSPECT-PROJECT-EMPTY"]
    },
    {
      "item": "BGA-100",
      "case": "A partial project reports which component identified its form",
      "boundary": "packaged",
      "scenarios": ["E2E-INSPECT-PROJECT-PARTIAL"]
    },
    {
      "item": "BGA-100",
      "case": "A project whose files cannot be read reports the refusal",
      "boundary": "packaged",
      "scenarios": ["E2E-INSPECT-PROJECT-UNREADABLE-FILES"]
    },
    {
      "item": "BGA-100",
      "case": "A project nested inside another configured root resolves to one project",
      "boundary": "packaged",
      "scenarios": ["E2E-INSPECT-PROJECT-NESTED-ROOT"]
    },
    {
      "item": "BGA-102",
      "case": "The published output schema is stable and complete",
      "boundary": "packaged",
      "scenarios": ["E2E-INSPECT-PROJECT-MODERN"]
    },
    {
      "item": "BGA-102",
      "case": "Paths in a result are project-relative and safe",
      "boundary": "packaged",
      "scenarios": ["E2E-INSPECT-PROJECT-LEGACY"]
    },
    {
      "item": "BGA-102",
      "case": "Inspection changes no file in the project",
      "boundary": "packaged",
      "scenarios": ["E2E-INSPECT-PROJECT-MODERN", "E2E-INSPECT-PROJECT-HYBRID"]
    },
    {
      "item": "BGA-102",
      "case": "A large project stays within the output limit",
      "boundary": "packaged",
      "scenarios": ["E2E-INSPECT-PROJECT-OUTPUT-LIMIT"]
    },
    {
      "item": "BGA-103",
      "case": "The summary resource matches inspect_project semantics",
      "boundary": "packaged",
      "scenarios": ["E2E-RESOURCE-SUMMARY"]
    },
    {
      "item": "BGA-103",
      "case": "The resource declares its media type and version",
      "boundary": "packaged",
      "scenarios": ["E2E-RESOURCE-DISCOVERY"]
    },
    {
      "item": "BGA-103",
      "case": "The resource stays bounded for a large project",
      "boundary": "packaged",
      "scenarios": ["E2E-RESOURCE-SUMMARY-BOUNDED"]
    },
    {
      "item": "BGA-104",
      "case": "Legacy and modern state representations produce one documented shape",
      "boundary": "packaged",
      "scenarios": ["E2E-RESOURCE-STATES"]
    },
    {
      "item": "BGA-104",
      "case": "The states resource is proven on every supported generation",
      "boundary": "packaged",
      "scenarios": ["E2E-RESOURCE-STATES-GENERATIONS"]
    },
    {
      "item": "BGA-105",
      "case": "Diagnostics are deterministic for unchanged files",
      "boundary": "packaged",
      "scenarios": ["E2E-RESOURCE-DIAGNOSTICS"]
    },
    {
      "item": "BGA-105",
      "case": "Diagnostics carry the rule and evidence versions",
      "boundary": "packaged",
      "scenarios": ["E2E-RESOURCE-DIAGNOSTICS"]
    },
    {
      "item": "BGA-105",
      "case": "Diagnostics never imply an unsupported check passed",
      "boundary": "packaged",
      "scenarios": ["E2E-RESOURCE-DIAGNOSTICS-UNSUPPORTED"]
    },
    {
      "item": "BGA-105",
      "case": "A resource refreshes within one session when the project changes",
      "boundary": "packaged",
      "scenarios": ["E2E-RESOURCE-REFRESH"]
    },
    {
      "item": "BGA-106",
      "case": "A valid machine passes and the rule catalog ships with the result",
      "boundary": "packaged",
      "scenarios": ["E2E-VALIDATE-STATES-CLEAN"]
    },
    {
      "item": "BGA-106",
      "case": "Every seeded defect is found, with facts and heuristics distinguished",
      "boundary": "packaged",
      "scenarios": ["E2E-VALIDATE-STATES-SEEDED-DEFECTS"]
    },
    {
      "item": "BGA-106",
      "case": "Every state rule has positive and negative public evidence",
      "boundary": "packaged",
      "scenarios": ["E2E-VALIDATE-STATES-CLEAN", "E2E-VALIDATE-STATES-RULE-COVERAGE"]
    },
    {
      "item": "BGA-107",
      "case": "Missing entry points, mismatched arguments, and broken handler links are located",
      "boundary": "packaged",
      "scenarios": ["E2E-VALIDATE-ACTIONS-SEEDED-DEFECTS"]
    },
    {
      "item": "BGA-107",
      "case": "A dynamic or malformed action call is reported rather than guessed",
      "boundary": "packaged",
      "scenarios": ["E2E-VALIDATE-ACTIONS-UNSUPPORTED-SYNTAX"]
    },
    {
      "item": "BGA-108",
      "case": "Missing handlers, name mismatches, and payload disagreements are distinguished",
      "boundary": "packaged",
      "scenarios": ["E2E-VALIDATE-NOTIFICATIONS-SEEDED-DEFECTS"]
    },
    {
      "item": "BGA-108",
      "case": "A dynamic notification name or payload is reported rather than guessed",
      "boundary": "packaged",
      "scenarios": ["E2E-VALIDATE-NOTIFICATIONS-UNSUPPORTED-SYNTAX"]
    },
    {
      "item": "BGA-109",
      "case": "SQL is read without connecting to or executing against a database",
      "boundary": "packaged",
      "scenarios": ["E2E-AUDIT-DATABASE-CLEAN", "E2E-READ-ONLY-NETWORK-DENIED"]
    },
    {
      "item": "BGA-109",
      "case": "A query the reader cannot follow is reported rather than reconstructed",
      "boundary": "packaged",
      "scenarios": ["E2E-AUDIT-DATABASE-MODERN-DEFECTS"]
    },
    {
      "item": "BGA-109",
      "case": "Malformed SQL and dialect limits are explicit in a public result",
      "boundary": "packaged",
      "scenarios": ["E2E-AUDIT-DATABASE-UNREADABLE-STATEMENT"]
    },
    {
      "item": "BGA-110",
      "case": "Manual-only checks stay manual in a public result",
      "boundary": "packaged",
      "scenarios": ["E2E-PRE-RELEASE-MANUAL-NEVER-PASSES"]
    },
    {
      "item": "BGA-110",
      "case": "The catalog version used is identified in the result",
      "boundary": "packaged",
      "scenarios": ["E2E-PRE-RELEASE-CATALOG-VERSION"]
    },
    {
      "item": "BGA-110",
      "case": "Every automated rule has valid and failing fixtures, enforced for the modern layout too",
      "boundary": "repository",
      "scenarios": ["GATE-FIXTURE-SAFETY"]
    },
    {
      "item": "BGA-111",
      "case": "An unimplemented or unrun check is never converted into a pass",
      "boundary": "packaged",
      "scenarios": ["E2E-PRE-RELEASE-PARTIAL-SUPPORT", "E2E-PRE-RELEASE-UNSUPPORTED-PRESERVED"]
    },
    {
      "item": "BGA-111",
      "case": "A failing project fails the checks it breaks, with their findings",
      "boundary": "packaged",
      "scenarios": ["E2E-PRE-RELEASE-FAILING"]
    },
    {
      "item": "BGA-112",
      "case": "Aggregation preserves the evidence and certainty of each part",
      "boundary": "packaged",
      "scenarios": ["E2E-VALIDATE-PROJECT-MATCHES-PARTS"]
    },
    {
      "item": "BGA-112",
      "case": "Skipped and unsupported groups are reported as such",
      "boundary": "packaged",
      "scenarios": ["E2E-VALIDATE-PROJECT-GROUP-SELECTION"]
    },
    {
      "item": "BGA-112",
      "case": "A failed validator cannot be hidden by the aggregate",
      "boundary": "packaged",
      "scenarios": ["E2E-VALIDATE-PROJECT-PARTIAL-FAILURE"]
    },
    {